{
  "dataset_id": "egaroucid-sequence-v0002-local",
  "source_name": "Egaroucid v0002 local sequence transcript training data",
  "source_url": "https://www.egaroucid.nyanyan.dev/ja/technology/train-data/",
  "retrieved_at": "2026-06-19",
  "license_or_terms": "Custom terms published by Egaroucid: free use for own Othello AI activities; raw data redistribution is prohibited.",
  "redistribution_allowed": false,
  "commercial_use_allowed": "unknown",
  "derived_weights_allowed": "unknown",
  "required_attribution": "Attribution is requested but not required by the published terms; cite Egaroucid training data and https://www.egaroucid.nyanyan.dev/ja/technology/train-data/ when used.",
  "local_path": "data/corpora/local/Egaroucid_Train_Data_v0002_*.zip",
  "sha256": "local-only-not-recorded",
  "notes": "Manifest-only local corpus reference for sequence/transcript data. Keep raw zips, generated normalized TSVs, local run reports, datasets, weights, and artifacts under ignored local paths. Labels produced by the importer are final-disc-difference labels derived from transcript final boards, not teacher-search labels."
}
